{
  "$schema": "http://json-schema.org/draft-07/schema#",
  "title": "Receipt",
  "type": "object",
  "properties": {
    "receiptNo": { "type": "string" },
    "businessName": { "type": ["string", "null"] },
    "address": { "type": ["string", "null"] },
    "phone": { "type": ["string", "null"] },
    "lines": {
      "type": "array",
      "items": {
        "type": "object",
        "properties": {
          "name": { "type": "string" },
          "qty": { "type": "number" },
          "price": { "type": "number" },
          "total": { "type": "number" }
        },
        "required": ["name", "qty", "price", "total"],
        "additionalProperties": true
      }
    },
    "totals": {
      "type": "object",
      "properties": {
        "subtotal": { "type": ["number", "null"] },
        "tax": { "type": ["number", "null"] },
        "grandTotal": { "type": ["number", "null"] }
      },
      "additionalProperties": true
    }
  },
  "required": ["receiptNo", "lines"],
  "additionalProperties": true
}

